施設名,施設名(英語),カテゴリ,都道府県名,市区町村名,行政区名,住所,住所(かな),電話番号,対象地区,対象に対する記述,緯度,経度,海抜(m),避難所高さ(m),許容人数,洪水対応,土砂災害対応,高潮対応,地震対応,津波対応,浸水対応,大火事対応,噴火対応,説明(日本語),説明(英語),標準地域コード
品川学園,Integrated E. & Jr. H. Sch. Shinagawa-gakuen,避難所,東京都,"","",品川区北品川3-9-30,"",03-3474-2671,北品川2丁目(一部)、北品川3丁目全域、北品川4丁目(一部)、南品川4丁目(一部),北品川2丁目町会、北品川3丁目親和会、都営南品川アパート自治会,35.61805,139.737982,"","","","","","","","","","","",地震等による家屋の倒壊、焼失などで被害を受けた方、また、被害を受ける恐れのある方を一時的に受け入れ、保護するために開設するもの。,"",http://statdb.nstac.go.jp/lod/sac/C13109
御殿山小学校,Gotenyama E. Sch.,避難所,東京都,"","",品川区北品川5-2-6,"",03-3441-0674,北品川4丁目(一部)、北品川5丁目全域、北品川6丁目全域、東五反田2丁目(一部)、東五反田3丁目(一部),袖ケ崎新興会、御殿山町会、小関親睦会,35.623133,139.731772,"","","","","","","","","","","",地震等による家屋の倒壊、焼失などで被害を受けた方、また、被害を受ける恐れのある方を一時的に受け入れ、保護するために開設するもの。,"",http://statdb.nstac.go.jp/lod/sac/C13109
台場小学校,Daiba E. Sch.,避難所,東京都,"","",品川区東品川1-8-30,"",03-3471-4942,北品川1丁目全域、北品川2丁目(一部)、東品川1丁目(一部)、東品川2丁目全域、東品川5丁目全域,北品川1丁目町会、都営北品川アパート自治会、都営北品川第2アパート自治会、八ツ山町会、天王洲会、都営天王洲団地自治会、東品川1、3丁目町会、都営東品川第4アパート自治会、都営東品川7棟自治会,35.621383,139.743185,"","","","","","","","","","","",地震等による家屋の倒壊、焼失などで被害を受けた方、また、被害を受ける恐れのある方を一時的に受け入れ、保護するために開設するもの。,"",http://statdb.nstac.go.jp/lod/sac/C13109
城南小学校,Jonan E. Sch.,避難所,東京都,"","",品川区南品川2-8-21,"",03-3471-6000,南品川1丁目(一部)、南品川2丁目(一部)、南品川3丁目(一部)、南品川4丁目(一部)、南品川5丁目(一部),真交町会、博友町会、諏訪町会、明睦会、三睦会町会,35.613329,139.742746,"","","","","","","","","","","",地震等による家屋の倒壊、焼失などで被害を受けた方、また、被害を受ける恐れのある方を一時的に受け入れ、保護するために開設するもの。,"",http://statdb.nstac.go.jp/lod/sac/C13109
浅間台小学校,Asamadai E. Sch.,避難所,東京都,"","",品川区南品川6-8-8,"",03-3474-2727,南品川2丁目(一部)、南品川4丁目(一部)、南品川5丁目(一部)、南品川6丁目全域、広町1丁目全域,東睦会、南品川南睦会、同友会町会、六丁目睦会,35.611484,139.736494,"","","","","","","","","","","",地震等による家屋の倒壊、焼失などで被害を受けた方、また、被害を受ける恐れのある方を一時的に受け入れ、保護するために開設するもの。,"",http://statdb.nstac.go.jp/lod/sac/C13109
城南第二小学校,Jonan-dai-ni E. Sch.,避難所,東京都,"","",品川区東品川3-4-5,"",03-3471-7481,北品川2丁目(一部)、東品川1丁目(一部)、東品川3丁目(一部)、南品川1丁目(一部)、南品川2丁目(一部),△東親会、洌崎町会、櫻心会町会,35.615579,139.74599,"","","","","","","","","","","",地震等による家屋の倒壊、焼失などで被害を受けた方、また、被害を受ける恐れのある方を一時的に受け入れ、保護するために開設するもの。,"",http://statdb.nstac.go.jp/lod/sac/C13109
東海中学校,Tokai Jr. H. Sch.,避難所,東京都,"","",品川区東品川3-30-15,"",03-3471-6951,東品川3丁目(一部)、東品川4丁目全域,東品川第一自治会、都営東品川第3アパート自治会、△東親会、自治八潮会,35.612621,139.748971,"","","","","","","","","","","",地震等による家屋の倒壊、焼失などで被害を受けた方、また、被害を受ける恐れのある方を一時的に受け入れ、保護するために開設するもの。,"",http://statdb.nstac.go.jp/lod/sac/C13109
日野学園,Integrated E. & Jr. H. Sch. Hino-gakuen,避難所,東京都,"","",品川区東五反田2-11-1,"",03-3441-3200,東五反田1丁目(一部)、東五反田2丁目(一部)、東五反田3丁目(一部)、東五反田5丁目(一部)、西五反田1丁目(一部)、西五反田2丁目(一部)、西五反田3丁目(一部),五反田一丁目町会、東五反田みづほ町会、五反田中部町会、五反田東口町会、五反田睦町会、西五反田一・二・三町会、島津山自生会、都営東五反田二丁目アパート自治会,35.624505,139.728169,"","","","","","","","","","","",地震等による家屋の倒壊、焼失などで被害を受けた方、また、被害を受ける恐れのある方を一時的に受け入れ、保護するために開設するもの。,"",http://statdb.nstac.go.jp/lod/sac/C13109
第三日野小学校,Dai-san-hino E. Sch.,避難所,東京都,"","",品川区上大崎1-19-19,"",03-3441-7780,東五反田1丁目(一部)、東五反田3丁目(一部)、東五反田4丁目(一部)、東五反田5丁目(一部)、上大崎1丁目全域、上大崎2丁目全域、上大崎3丁目全域,池田山町会、袖が崎町会、相生会、上大崎一丁目町会、上大崎一丁目愛誠会、上大崎一丁目第一愛誠会、上大崎池の谷町会、上大崎目黒駅前町会、上大崎三丁目町会、目黒駅前西口町会、中丸親和町会、上大崎長者丸町会,35.632801,139.723819,"","","","","","","","","","","",地震等による家屋の倒壊、焼失などで被害を受けた方、また、被害を受ける恐れのある方を一時的に受け入れ、保護するために開設するもの。,"",http://statdb.nstac.go.jp/lod/sac/C13109
第四日野小学校,Dai-yon-hino E. Sch.,避難所,東京都,"","",品川区西五反田4-29-9,"",03-3491-1281,上大崎4丁目全域、西五反田3丁目(一部)、西五反田4丁目全域、西五反田5丁目(一部)、小山1丁目(一部)、小山台1丁目(一部),夕陽会、大崎本町三丁目町会、西五反田四丁目町会、西五反田五丁目西三町会,35.625804,139.712343,"","","","","","","","","","","",地震等による家屋の倒壊、焼失などで被害を受けた方、また、被害を受ける恐れのある方を一時的に受け入れ、保護するために開設するもの。,"",http://statdb.nstac.go.jp/lod/sac/C13109
第一日野小学校,Dai-ichi-hino E. Sch.,避難所,東京都,"","",品川区西五反田6-5-32,"",03-3492-6259,西五反田1丁目(一部)、西五反田2丁目(一部)、西五反田3丁目(一部)、西五反田5丁目(一部)、西五反田6丁目、西五反田7丁目、西五反田8丁目、大崎4丁目(一部)、荏原1丁目(一部),西五反田一丁目町会、西五反田本町会、西五反田七・五・三町会、西五反田西二町会、西五反田協和町会、西五反田六丁目町会、西五反田南町会,35.622168,139.716098,"","","","","","","","","","","",地震等による家屋の倒壊、焼失などで被害を受けた方、また、被害を受ける恐れのある方を一時的に受け入れ、保護するために開設するもの。,"",http://statdb.nstac.go.jp/lod/sac/C13109
芳水小学校,Hosui E. Sch.,避難所,東京都,"","",品川区大崎3-12-22,"",03-3491-0071,大崎1丁目全域、大崎2丁目全域、大崎3丁目全域、大崎4丁目(一部)、大崎5丁目全域,大崎一二三町会、大崎三五町会、大崎四丁目町会、大崎居木橋町会、大崎ウエストシティタワーズ自治会,35.619255,139.724717,"","","","","","","","","","","",地震等による家屋の倒壊、焼失などで被害を受けた方、また、被害を受ける恐れのある方を一時的に受け入れ、保護するために開設するもの。,"",http://statdb.nstac.go.jp/lod/sac/C13109
三木小学校,Mitsugi E. Sch.,避難所,東京都,"","",品川区西品川3-16-28,"",03-3491-0404,西品川1丁目(一部)、西品川2丁目(一部)、西品川3丁目(一部)、豊町1丁目(一部),西品川三栄会、協力睦会、西品川新生会、西品川三ツ木会,35.615528,139.726856,"","","","","","","","","","","",地震等による家屋の倒壊、焼失などで被害を受けた方、また、被害を受ける恐れのある方を一時的に受け入れ、保護するために開設するもの。,"",http://statdb.nstac.go.jp/lod/sac/C13109
大崎中学校,Osaki Jr. H. Sch.,避難所,東京都,"","",品川区西品川3-10-6,"",03-3491-6623,西品川2丁目(一部)、西品川3丁目(一部)、戸越1丁目(一部),品川尚和会、西品川二丁目会,35.615836,139.723011,"","","","","","","","","","","",地震等による家屋の倒壊、焼失などで被害を受けた方、また、被害を受ける恐れのある方を一時的に受け入れ、保護するために開設するもの。,"",http://statdb.nstac.go.jp/lod/sac/C13109
立会小学校,Tachiai E. Sch.,避難所,東京都,"","",品川区東大井4-15-9,"",03-3474-4923,東大井1丁目(一部)、東大井3丁目(一部)、東大井4丁目(一部)、東大井5丁目(一部)、東大井6丁目(一部),大井立会町会、東大井林町会、東大井月見台町会、鮫洲仲町会、△大井元芝町会,35.604469,139.740191,"","","","","","","","","","","",地震等による家屋の倒壊、焼失などで被害を受けた方、また、被害を受ける恐れのある方を一時的に受け入れ、保護するために開設するもの。,"",http://statdb.nstac.go.jp/lod/sac/C13109
鮫浜小学校,Samehama E. Sch.,避難所,東京都,"","",品川区東大井2-10-14,"",03-3474-4923,東大井1丁目(一部)、東大井2丁目(一部),鮫洲北町会、△大井元芝町会、△鮫洲曙町会、鮫洲南町会、北浜川東町会、北浜川仲町会,35.601716,139.740669,"","","","","","","","","","","",地震等による家屋の倒壊、焼失などで被害を受けた方、また、被害を受ける恐れのある方を一時的に受け入れ、保護するために開設するもの。,"",http://statdb.nstac.go.jp/lod/sac/C13109
浜川中学校,Hamakawa Jr. H. Sch.,避難所,東京都,"","",品川区東大井3-18-34,"",03-3761-1014,東大井2丁目(一部)、東大井3丁目(一部)、東大井6丁目(一部),大井関ヶ原町会、北浜川西町会,35.6002,139.737944,"","","","","","","","","","","",地震等による家屋の倒壊、焼失などで被害を受けた方、また、被害を受ける恐れのある方を一時的に受け入れ、保護するために開設するもの。,"",http://statdb.nstac.go.jp/lod/sac/C13109
浜川小学校,Hamakawa E. Sch.,避難所,東京都,"","",品川区南大井4-3-27,"",03-3761-0530,南大井1丁目(一部)、南大井4丁目(一部)、南大井5丁目(一部)、東大井6丁目(一部),大井寺下町会、△南大井第四町会、△大井南浜町会、,35.59828,139.736203,"","","","","","","","","","","",地震等による家屋の倒壊、焼失などで被害を受けた方、また、被害を受ける恐れのある方を一時的に受け入れ、保護するために開設するもの。,"",http://statdb.nstac.go.jp/lod/sac/C13109
鈴ケ森小学校,Suzugamori E. Sch.,避難所,東京都,"","",品川区南大井4-16-2,"",03-3763-6631,南大井3丁目全域、南大井5丁目(一部)、南大井6丁目(一部),大井水神町会、大井坂下町会、大森駅前住宅自治会、△鈴ケ森町会、△大井海岸町会,35.594478,139.735242,"","","","","","","","","","","",地震等による家屋の倒壊、焼失などで被害を受けた方、また、被害を受ける恐れのある方を一時的に受け入れ、保護するために開設するもの。,"",http://statdb.nstac.go.jp/lod/sac/C13109
鈴ケ森中学校,Suzugamori Jr. H. Sch.,避難所,東京都,"","",品川区南大井2-3-14,"",03-3765-2849,南大井1丁目(一部)、南大井2丁目全域、勝島1丁目全域、勝島2丁目全域,△鈴ケ森町会、△大井海岸町会、勝島町会、勝島公務員住宅自治会、△大井南浜町会、△南大井第四町会、,35.593149,139.73778,"","","","","","","","","","","",地震等による家屋の倒壊、焼失などで被害を受けた方、また、被害を受ける恐れのある方を一時的に受け入れ、保護するために開設するもの。,"",http://statdb.nstac.go.jp/lod/sac/C13109
山中小学校,Yamanaka E. Sch.,避難所,東京都,"","",品川区大井3-7-19,"",03-3772-3006,大井1丁目全域、大井2丁目全域、大井3丁目全域、二葉1丁目(一部),大井一丁目権現町会、大井一丁目鎧町会、大井三丁目町会、大井森下町会、大井二丁目町会,35.602788,139.729925,"","","","","","","","","","","",地震等による家屋の倒壊、焼失などで被害を受けた方、また、被害を受ける恐れのある方を一時的に受け入れ、保護するために開設するもの。,"",http://statdb.nstac.go.jp/lod/sac/C13109
伊藤学園,Integrated E. & Jr. H. Sch. Ito-gakuen,避難所,東京都,"","",品川区大井5-1-37,"",03-3771-3374,大井5丁目全域、西大井1丁目全域,大井滝王子町会、西大井1丁目町会,35.600152,139.726095,"","","","","","","","","","","",地震等による家屋の倒壊、焼失などで被害を受けた方、また、被害を受ける恐れのある方を一時的に受け入れ、保護するために開設するもの。,"",http://statdb.nstac.go.jp/lod/sac/C13109
大井第一小学校,Oi-dai-ichi E. Sch.,避難所,東京都,"","",品川区大井6-1-32,"",03-3771-5240,大井4丁目全域、大井6丁目全域、大井7丁目(一部),大井鹿島町会、大井庚塚町会、大井倉田町会,35.598722,139.731187,"","","","","","","","","","","",地震等による家屋の倒壊、焼失などで被害を受けた方、また、被害を受ける恐れのある方を一時的に受け入れ、保護するために開設するもの。,"",http://statdb.nstac.go.jp/lod/sac/C13109
ウェルカムセンター原,Welcome Ctr. Hara,避難所,東京都,"","",品川区西大井2-5-21,"",03-5742-4660,大井7丁目(一部)、西大井2丁目(一部)、西大井3丁目全域,出石町会、西大井二丁目町会,35.599255,139.721865,"","","","","","","","","","","",地震等による家屋の倒壊、焼失などで被害を受けた方、また、被害を受ける恐れのある方を一時的に受け入れ、保護するために開設するもの。,"",http://statdb.nstac.go.jp/lod/sac/C13109
伊藤小学校,Ito E. Sch.,避難所,東京都,"","",品川区西大井5-6-8,"",03-3771-5289,西大井2丁目(一部)、西大井4丁目全域、西大井6丁目(一部),西大井四丁目町会、西大井六丁目町会,35.598755,139.717279,"","","","","","","","","","","",地震等による家屋の倒壊、焼失などで被害を受けた方、また、被害を受ける恐れのある方を一時的に受け入れ、保護するために開設するもの。,"",http://statdb.nstac.go.jp/lod/sac/C13109
冨士見台中学校,Fujimidai Jr. H. Sch.,避難所,東京都,"","",品川区西大井5-5-14,"",03-3772-0900,西大井5丁目全域,西大井五丁目伊藤町会,35.598555,139.715263,"","","","","","","","","","","",地震等による家屋の倒壊、焼失などで被害を受けた方、また、被害を受ける恐れのある方を一時的に受け入れ、保護するために開設するもの。,"",http://statdb.nstac.go.jp/lod/sac/C13109
小山台小学校,Koyamadai E. Sch.,避難所,東京都,"","",品川区小山台1-18-24,"",03-3712-7692,小山台1丁目全域、小山台2丁目(一部),小山台1丁目町会、小山台1丁目東町会、小山台2丁目町会,35.622793,139.703471,"","","","","","","","","","","",地震等による家屋の倒壊、焼失などで被害を受けた方、また、被害を受ける恐れのある方を一時的に受け入れ、保護するために開設するもの。,"",http://statdb.nstac.go.jp/lod/sac/C13109
後地小学校,Usiroji E. Sch.,避難所,東京都,"","",品川区小山2-4-6,"",03-3781-0890,小山1丁目(一部)、小山2丁目全域,小山1丁目町会、小山2丁目東部町会、小山2丁目西部町会,35.621568,139.708571,"","","","","","","","","","","",地震等による家屋の倒壊、焼失などで被害を受けた方、また、被害を受ける恐れのある方を一時的に受け入れ、保護するために開設するもの。,"",http://statdb.nstac.go.jp/lod/sac/C13109
小山小学校,Koyama E. Sch.,避難所,東京都,"","",品川区小山5-10-6,"",03-3781-0282,小山3丁目全域、小山4丁目全域、荏原5丁目全域,小山3丁目町会、小山4丁目町会、荏原5丁目町会,35.616002,139.703249,"","","","","","","","","","","",地震等による家屋の倒壊、焼失などで被害を受けた方、また、被害を受ける恐れのある方を一時的に受け入れ、保護するために開設するもの。,"",http://statdb.nstac.go.jp/lod/sac/C13109
荏原第一中学校,Ebara-dai-ichi Jr. H. Sch.,避難所,東京都,"","",品川区荏原1-24-30,"",03-3785-1680,荏原1丁目(一部)、荏原2丁目(一部),荏原1丁目町会、荏原2丁目町会,35.619447,139.712868,"","","","","","","","","","","",地震等による家屋の倒壊、焼失などで被害を受けた方、また、被害を受ける恐れのある方を一時的に受け入れ、保護するために開設するもの。,"",http://statdb.nstac.go.jp/lod/sac/C13109
荏原第六中学校,Ebara-dai-roku Jr. H. Sch.,避難所,東京都,"","",品川区小山5-20-19,"",03-3781-7776,小山5丁目全域,小山5丁目町会,35.616363,139.699877,"","","","","","","","","","","",地震等による家屋の倒壊、焼失などで被害を受けた方、また、被害を受ける恐れのある方を一時的に受け入れ、保護するために開設するもの。,"",http://statdb.nstac.go.jp/lod/sac/C13109
第二延山小学校,Dai-ni-enzan E. Sch.,避難所,東京都,"","",品川区旗の台1-6-1,"",03-3781-1466,小山6丁目全域、小山7丁目全域、荏原6丁目(一部)、荏原7丁目全域、旗の台1丁目全域,小山6丁目町会、小山7丁目町会、荏原6丁目町会、荏原7丁目町会、旗の台1丁目町会,35.61012,139.703613,"","","","","","","","","","","",地震等による家屋の倒壊、焼失などで被害を受けた方、また、被害を受ける恐れのある方を一時的に受け入れ、保護するために開設するもの。,"",http://statdb.nstac.go.jp/lod/sac/C13109
清水台小学校,Shimizudai E. Sch.,避難所,東京都,"","",品川区旗の台1-11-17,"",03-3781-4841,旗の台2丁目全域、旗の台6丁目(一部),小山洗足町会、旗の台2丁目町会、旗の台西2丁目町会、旗の台6丁目町会、東洗足自治会,35.60742,139.70233,"","","","","","","","","","","",地震等による家屋の倒壊、焼失などで被害を受けた方、また、被害を受ける恐れのある方を一時的に受け入れ、保護するために開設するもの。,"",http://statdb.nstac.go.jp/lod/sac/C13109
京陽小学校,Keiyo E. Sch.,避難所,東京都,"","",品川区平塚2-19-20,"",03-3781-0058,平塚1丁目(一部)、平塚2丁目全域、荏原1丁目(一部)、荏原2丁目(一部),平塚1丁目町会、平塚2丁目町会、中原共和町会,35.615116,139.713079,"","","","","","","","","","","",地震等による家屋の倒壊、焼失などで被害を受けた方、また、被害を受ける恐れのある方を一時的に受け入れ、保護するために開設するもの。,"",http://statdb.nstac.go.jp/lod/sac/C13109
荏原平塚学園,Integrated E. & Jr. H. Sch. Ebara-hiratsuka-gakuen,避難所,東京都,"","",品川区平塚3-16-26,"",03-3782-7770,西中延1丁目(一部)、東中延1丁目全域、荏原2丁目(一部)、戸越5丁目(一部)、平塚1丁目(一部)、平塚3丁目全域,荏原平塚学園、平塚1丁目南部町会、平塚3丁目町会、東中延1丁目町会、西中延自治会,35.615325,139.710101,"","","","","","","","","","","",地震等による家屋の倒壊、焼失などで被害を受けた方、また、被害を受ける恐れのある方を一時的に受け入れ、保護するために開設するもの。,"",http://statdb.nstac.go.jp/lod/sac/C13109
スクエア荏原（平塚小学校跡地）,"",避難所,東京都,"","",品川区荏原4-5-28,"",03-5788-5321,西中延1丁目(一部)、荏原3丁目全域、荏原4丁目全域,平塚4丁目町会、荏原3丁目町会、荏原4丁目町会,35.615344,139.707492,"","","","","","","","","","","",地震等による家屋の倒壊、焼失などで被害を受けた方、また、被害を受ける恐れのある方を一時的に受け入れ、保護するために開設するもの。,"",http://statdb.nstac.go.jp/lod/sac/C13109
中延小学校,Nakanobu E. Sch.,避難所,東京都,"","",品川区中延1-11-15,"",03-3781-4031,中延1丁目全域、中延2丁目(一部)、西中延1丁目(一部)、荏原6丁目(一部),中延1丁目町会、西中延1丁目町会,35.612567,139.709502,"","","","","","","","","","","",地震等による家屋の倒壊、焼失などで被害を受けた方、また、被害を受ける恐れのある方を一時的に受け入れ、保護するために開設するもの。,"",http://statdb.nstac.go.jp/lod/sac/C13109
延山小学校,Enzan E. Sch.,避難所,東京都,"","",品川区西中延2-17-5,"",03-3781-3806,中延2丁目(一部)、中延3丁目全域、西中延2丁目全域、西中延3丁目全域,中延2丁目町会、西中延2丁目町会、中延3丁目町会、西中延3丁目町会,35.609012,139.708082,"","","","","","","","","","","",地震等による家屋の倒壊、焼失などで被害を受けた方、また、被害を受ける恐れのある方を一時的に受け入れ、保護するために開設するもの。,"",http://statdb.nstac.go.jp/lod/sac/C13109
戸越台中学校,Togoshidai Jr. H. Sch.,避難所,東京都,"","",品川区戸越1-15-23,"",03-3781-6250,戸越1丁目(一部)、戸越2丁目全域、戸越3丁目(一部),戸越銀座町会、戸越1丁目町会、戸越2丁目町会,35.615706,139.717587,"","","","","","","","","","","",地震等による家屋の倒壊、焼失などで被害を受けた方、また、被害を受ける恐れのある方を一時的に受け入れ、保護するために開設するもの。,"",http://statdb.nstac.go.jp/lod/sac/C13109
宮前小学校,Miyamae E. Sch.,避難所,東京都,"","",品川区戸越4-5-10,"",03-3781-4386,戸越3丁目(一部)、戸越4丁目全域、戸越5丁目(一部),戸越3丁目町会、戸越4丁目町会、戸越5丁目町会,35.611878,139.718329,"","","","","","","","","","","",地震等による家屋の倒壊、焼失などで被害を受けた方、また、被害を受ける恐れのある方を一時的に受け入れ、保護するために開設するもの。,"",http://statdb.nstac.go.jp/lod/sac/C13109
大原小学校,Ohara E. Sch.,避難所,東京都,"","",品川区戸越6-17-3,"",03-3781-4487,東中延2丁目(一部)、戸越6丁目(一部)、中延4丁目(一部),東中延2丁目町会、戸越6丁目町会,35.607323,139.715998,"","","","","","","","","","","",地震等による家屋の倒壊、焼失などで被害を受けた方、また、被害を受ける恐れのある方を一時的に受け入れ、保護するために開設するもの。,"",http://statdb.nstac.go.jp/lod/sac/C13109
源氏前小学校,Genjimae E. Sch.,避難所,東京都,"","",品川区中延6-2-18,"",03-3781-0040,中延4丁目全域、中延5丁目(一部)、中延6丁目(一部)、東中延2丁目(一部)、豊町6丁目(一部)、戸越6丁目(一部)、二葉4丁目(一部)、西大井6丁目(一部),中延4丁目町会、荏原町町会、△東中三町会、中延6丁目町会,35.603448,139.711677,"","","","","","","","","","","",地震等による家屋の倒壊、焼失などで被害を受けた方、また、被害を受ける恐れのある方を一時的に受け入れ、保護するために開設するもの。,"",http://statdb.nstac.go.jp/lod/sac/C13109
上神明小学校,Kami-shinmei E. Sch.,避難所,東京都,"","",品川区二葉4-4-10,"",03-3781-4633,豊町6丁目全域、二葉4丁目(一部)、西大井6丁目(一部)、中延4丁目(一部)、東中延2丁目(一部)、戸越6丁目(一部),豊町6丁目町会、二葉4丁目町会、△東中三町会,35.603079,139.715082,"","","","","","","","","","","",地震等による家屋の倒壊、焼失などで被害を受けた方、また、被害を受ける恐れのある方を一時的に受け入れ、保護するために開設するもの。,"",http://statdb.nstac.go.jp/lod/sac/C13109
