旗台小学校,Hatanodai E. Sch.,避難所,東京都,"","",品川区旗の台4-7-11,"",03-3785-1729,中延5丁目(一部)、旗の台4丁目全域,中延5丁目町会、旗の台4丁目町会,35.603354,139.704194,"","","","","","","","","","","",地震等による家屋の倒壊、焼失などで被害を受けた方、また、被害を受ける恐れのある方を一時的に受け入れ、保護するために開設するもの。,"",http://statdb.nstac.go.jp/lod/sac/C13109
荏原第五中学校,Ebara-dai-go Jr. H. Sch.,避難所,東京都,"","",品川区旗の台5-11-13,"",03-3781-5643,旗の台3丁目全域、旗の台5丁目全域、旗の台6丁目(一部),旗の台3丁目町会、旗の台5丁目町会、旗の台南町会,35.603156,139.702102,"","","","","","","","","","","",地震等による家屋の倒壊、焼失などで被害を受けた方、また、被害を受ける恐れのある方を一時的に受け入れ、保護するために開設するもの。,"",http://statdb.nstac.go.jp/lod/sac/C13109
戸越小学校,Togoshi E. Sch.,避難所,東京都,"","",品川区豊町2-1-20,"",03-3781-2833,豊町1丁目全域、豊町2丁目全域、西品川1丁目(一部)、西品川2丁目(一部),豊町1丁目町会、豊町2丁目親和会,35.610762,139.720973,"","","","","","","","","","","",地震等による家屋の倒壊、焼失などで被害を受けた方、また、被害を受ける恐れのある方を一時的に受け入れ、保護するために開設するもの。,"",http://statdb.nstac.go.jp/lod/sac/C13109
旧荏原第四中学校,Ebara-dai-yon Jr. H. Sch.,避難所,東京都,"","",品川区豊町3-5-31,"","",豊町3丁目全域、豊町4丁目（一部）,豊町3丁目町会、豊町4丁目町会（一部）,35.609009,139.721045,"","","","","","","","","","","",地震等による家屋の倒壊、焼失などで被害を受けた方、また、被害を受ける恐れのある方を一時的に受け入れ、保護するために開設するもの。,"",http://statdb.nstac.go.jp/lod/sac/C13109
豊葉の杜学園,"",避難所,東京都,"","",品川区二葉1-3-40,"",03-3782-2930,二葉1丁目全域、二葉2丁目(一部)、大井2丁目(一部)、広町2丁目(一部),二葉1丁目町会、二葉神明町会、二葉2丁目町会、二葉中央町会（一部）,35.607287,139.725687,"","","","","","","","","","","",地震等による家屋の倒壊、焼失などで被害を受けた方、また、被害を受ける恐れのある方を一時的に受け入れ、保護するために開設するもの。,"",http://statdb.nstac.go.jp/lod/sac/C13109
旧杜松小学校(杜松ホーム),Tosho E. Sch.,避難所,東京都,"","",品川区豊町4-24-15,"",03-6426-8213 ,豊町4丁目（一部）、豊町5丁目全域、二葉2丁目(一部)、二葉3丁目全域,豊町4丁目町会、豊町5丁目町会、二葉中央町会、二葉3丁目町会,35.606135,139.722764,"","","","","","","","","","","",地震等による家屋の倒壊、焼失などで被害を受けた方、また、被害を受ける恐れのある方を一時的に受け入れ、保護するために開設するもの。,"",http://statdb.nstac.go.jp/lod/sac/C13109
明晴学園,Meisei Gakuen,避難所,東京都,"","",品川区八潮5-2-1,"",03-6380-6775,1号棟〜10号棟(八潮5丁目1〜3番)、品川総合福祉センター、八潮1丁目〜八潮3丁目,八潮1号棟自治会、品川八潮2号棟自治会、八潮団地都営3号棟自治会、八潮4号棟自治会、品川八潮5号棟自治会、八潮ハイツ自治会、八潮パークタウン第7号棟自治会,35.603872,139.753107,"","","","","","","","","","","",地震等による家屋の倒壊、焼失などで被害を受けた方、また、被害を受ける恐れのある方を一時的に受け入れ、保護するために開設するもの。,"",http://statdb.nstac.go.jp/lod/sac/C13109
八潮学園,Integrated E. & Jr. H. Sch. Yashio-gakuen ,避難所,東京都,"","",品川区八潮5-11-2,"",03-3799-1641,11号棟〜23号棟、51〜69号棟、八潮わかくさ荘(八潮5丁目3〜5番、10〜12番),八潮11号棟自治会、八潮12号棟自治会、コーシャハイム八潮西自治会、シティコープ八潮浜自治会、潮路東ハイツ自治会、八潮58、59号棟自治会 八潮60号棟自治会、八潮わかくさ荘自治会、69号棟自治会、八潮パークタウン潮路北第1ハイツ自治会,35.601392,139.75253,"","","","","","","","","","","",地震等による家屋の倒壊、焼失などで被害を受けた方、また、被害を受ける恐れのある方を一時的に受け入れ、保護するために開設するもの。,"",http://statdb.nstac.go.jp/lod/sac/C13109
こみゅにてぃぷらざ八潮,"",避難所,東京都,"","",品川区八潮5-9-11,"",03-3799-2021,24号棟〜50号棟、八潮寮(八潮5丁目6番、8番、10番)、八潮4丁目,八潮パークタウン潮路南第二ハイツ自治会、八潮パークタウン潮路南第一ハイツ自治会、八潮40号棟自治会、第41号棟自治会、42号棟自治会、八潮43号棟自治会、シティコープ八潮台自治会、八潮南47号棟自治会、八潮5丁目48号棟自治会、八潮49号棟自治会、50号棟自治会、八潮寮自治会,35.5982,139.752355,"","","","","","","","","","","",地震等による家屋の倒壊、焼失などで被害を受けた方、また、被害を受ける恐れのある方を一時的に受け入れ、保護するために開設するもの。,"",http://statdb.nstac.go.jp/lod/sac/C13109
高輪三丁目・四丁目・御殿山地区,"",広域避難場所,東京都,"","",港区高輪、品川区北品川,"","",北品川5〜6丁目、4丁目の一部、東五反田1、3丁目の各一部,"",35.6222,139.737005,"","","","","","","","","","","",大地震時に発生する延焼火災等の危険から避難者の身の安全を確保し、火勢の弱まりを待つ場所,"",http://statdb.nstac.go.jp/lod/sac/C13109
自然教育園・聖心女子学院一帯,"",広域避難場所,東京都,"","",港区白金、白金台,"","",荏原1丁目の一部、上大崎1〜4丁目、西五反田3、5、6丁目の各一部、東五反田4丁目、①3丁目の各一部,"",35.636276,139.720726,"","","","","","","","","","","",大地震時に発生する延焼火災等の危険から避難者の身の安全を確保し、火勢の弱まりを待つ場所,"",http://statdb.nstac.go.jp/lod/sac/C13109
JRアパート・品川区役所一帯,"",広域避難場所,東京都,"","",品川区広町,"","",大井1〜3丁目、戸越1丁目、3丁目の一部、西品川3丁目、1〜2丁目の各一部、広町2丁目、二葉1丁目、2丁目の一部,"",35.609226,139.730186,"","","","","","","","","","","",大地震時に発生する延焼火災等の危険から避難者の身の安全を確保し、火勢の弱まりを待つ場所,"",http://statdb.nstac.go.jp/lod/sac/C13109
大井ふ頭一帯,"",広域避難場所,東京都,"","",品川区八潮、大田区城南島、東海,"","",北品川2丁目の一部、広町1丁目、南品川1〜3、5〜6丁目、4丁目の一部,"",35.594188,139.751807,"","","","","","","","","","","",大地震時に発生する延焼火災等の危険から避難者の身の安全を確保し、火勢の弱まりを待つ場所,"",http://statdb.nstac.go.jp/lod/sac/C13109
大井競馬場・しながわ区民公園,"",広域避難場所,東京都,"","",品川区勝島,"","",戸越6丁目、西大井1〜6丁目、大井4〜7丁目、中延4、6丁目、5丁目の一部、東大井1〜6丁目、東中延2丁目、南大井1〜6丁目、二葉3〜4丁目、2丁目の一部、豊町4〜6丁目,"",35.593274,139.739123,"","","","","","","","","","","",大地震時に発生する延焼火災等の危険から避難者の身の安全を確保し、火勢の弱まりを待つ場所,"",http://statdb.nstac.go.jp/lod/sac/C13109
東京工業大学,"",広域避難場所,東京都,"","",目黒区大岡山、大田区石川町,"","",荏原7丁目、6丁目の一部、旗の台1〜6丁目、小山6〜7丁目、西中延2〜3丁目、中延3丁目、2、5丁目の各一部,"",35.604224,139.682784,"","","","","","","","","","","",大地震時に発生する延焼火災等の危険から避難者の身の安全を確保し、火勢の弱まりを待つ場所,"",http://statdb.nstac.go.jp/lod/sac/C13109
林試の森公園,"",広域避難場所,東京都,"","",品川区小山台、目黒区下目黒,"","",荏原2〜5丁目、1、6丁目の各一部、小山1〜5丁目、小山台1〜2丁目、戸越5丁目の一部、中延1丁目、2丁目の一部、西中延1丁目、西五反田4〜5丁目の各一部、東中延1丁目、平塚1〜3丁目,"",35.625238,139.703786,"","","","","","","","","","","",大地震時に発生する延焼火災等の危険から避難者の身の安全を確保し、火勢の弱まりを待つ場所,"",http://statdb.nstac.go.jp/lod/sac/C13109
戸越公園一帯,"",広域避難場所,東京都,"","",品川区豊町,"","",戸越2、4丁目、3、5丁目の各一部、西品川1〜2丁目の各一部、豊町1〜3丁目,"",35.610598,139.722376,"","","","","","","","","","","",大地震時に発生する延焼火災等の危険から避難者の身の安全を確保し、火勢の弱まりを待つ場所,"",http://statdb.nstac.go.jp/lod/sac/C13109
天王洲アイル周辺,"",広域避難場所,東京都,"","",品川区東品川,"","",東品川1丁目、南品川4丁目の一部、北品川1、3丁目、2、4丁目の各一部,"",35.620331,139.750215,"","","","","","","","","","","",大地震時に発生する延焼火災等の危険から避難者の身の安全を確保し、火勢の弱まりを待つ場所,"",http://statdb.nstac.go.jp/lod/sac/C13109
大崎駅西口地区一帯,"",広域避難場所,東京都,"","",品川区大崎,"","",大崎2〜3丁目、4丁目の各一部,"",35.618461,139.727625,"","","","","","","","","","","",大地震時に発生する延焼火災等の危険から避難者の身の安全を確保し、火勢の弱まりを待つ場所,"",http://statdb.nstac.go.jp/lod/sac/C13109
